{
 "benchmark_comparison": {
  "benchmark": "naruto_uzumaki",
  "by_character": {
   "gaara": {
    "ahead_in": 0,
    "comparable_sources": 1,
    "ratios": {
     "amazon": null,
     "anime2you_articles": null,
     "anime2you_comments": null,
     "ebay": null,
     "google_trends": null,
     "kleinanzeigen": null,
     "narutop99": 0.39,
     "youtube_comments": null,
     "youtube_videos": null
    }
   },
   "hinata_hyuga": {
    "ahead_in": 0,
    "comparable_sources": 1,
    "ratios": {
     "amazon": null,
     "anime2you_articles": null,
     "anime2you_comments": null,
     "ebay": null,
     "google_trends": null,
     "kleinanzeigen": null,
     "narutop99": 0.79,
     "youtube_comments": null,
     "youtube_videos": null
    }
   },
   "itachi_uchiha": {
    "ahead_in": 1,
    "comparable_sources": 1,
    "ratios": {
     "amazon": null,
     "anime2you_articles": null,
     "anime2you_comments": null,
     "ebay": null,
     "google_trends": null,
     "kleinanzeigen": null,
     "narutop99": 3.7,
     "youtube_comments": null,
     "youtube_videos": null
    }
   },
   "jiraiya": {
    "ahead_in": 0,
    "comparable_sources": 1,
    "ratios": {
     "amazon": null,
     "anime2you_articles": null,
     "anime2you_comments": null,
     "ebay": null,
     "google_trends": null,
     "kleinanzeigen": null,
     "narutop99": 0.87,
     "youtube_comments": null,
     "youtube_videos": null
    }
   },
   "kakashi_hatake": {
    "ahead_in": 1,
    "comparable_sources": 1,
    "ratios": {
     "amazon": null,
     "anime2you_articles": null,
     "anime2you_comments": null,
     "ebay": null,
     "google_trends": null,
     "kleinanzeigen": null,
     "narutop99": 1.45,
     "youtube_comments": null,
     "youtube_videos": null
    }
   },
   "madara_uchiha": {
    "ahead_in": 1,
    "comparable_sources": 1,
    "ratios": {
     "amazon": null,
     "anime2you_articles": null,
     "anime2you_comments": null,
     "ebay": null,
     "google_trends": null,
     "kleinanzeigen": null,
     "narutop99": 1.44,
     "youtube_comments": null,
     "youtube_videos": null
    }
   },
   "minato_namikaze": {
    "ahead_in": 1,
    "comparable_sources": 1,
    "ratios": {
     "amazon": null,
     "anime2you_articles": null,
     "anime2you_comments": null,
     "ebay": null,
     "google_trends": null,
     "kleinanzeigen": null,
     "narutop99": 6.4,
     "youtube_comments": null,
     "youtube_videos": null
    }
   },
   "nagato_pain": {
    "ahead_in": 0,
    "comparable_sources": 1,
    "ratios": {
     "amazon": null,
     "anime2you_articles": null,
     "anime2you_comments": null,
     "ebay": null,
     "google_trends": null,
     "kleinanzeigen": null,
     "narutop99": 0.19,
     "youtube_comments": null,
     "youtube_videos": null
    }
   },
   "obito_uchiha": {
    "ahead_in": 0,
    "comparable_sources": 1,
    "ratios": {
     "amazon": null,
     "anime2you_articles": null,
     "anime2you_comments": null,
     "ebay": null,
     "google_trends": null,
     "kleinanzeigen": null,
     "narutop99": 0.98,
     "youtube_comments": null,
     "youtube_videos": null
    }
   },
   "orochimaru": {
    "ahead_in": 0,
    "comparable_sources": 1,
    "ratios": {
     "amazon": null,
     "anime2you_articles": null,
     "anime2you_comments": null,
     "ebay": null,
     "google_trends": null,
     "kleinanzeigen": null,
     "narutop99": 0.29,
     "youtube_comments": null,
     "youtube_videos": null
    }
   },
   "sasuke_uchiha": {
    "ahead_in": 0,
    "comparable_sources": 1,
    "ratios": {
     "amazon": null,
     "anime2you_articles": null,
     "anime2you_comments": null,
     "ebay": null,
     "google_trends": null,
     "kleinanzeigen": null,
     "narutop99": 1.0,
     "youtube_comments": null,
     "youtube_videos": null
    }
   },
   "shikamaru_nara": {
    "ahead_in": 0,
    "comparable_sources": 1,
    "ratios": {
     "amazon": null,
     "anime2you_articles": null,
     "anime2you_comments": null,
     "ebay": null,
     "google_trends": null,
     "kleinanzeigen": null,
     "narutop99": 0.55,
     "youtube_comments": null,
     "youtube_videos": null
    }
   },
   "tsunade": {
    "ahead_in": 0,
    "comparable_sources": 1,
    "ratios": {
     "amazon": null,
     "anime2you_articles": null,
     "anime2you_comments": null,
     "ebay": null,
     "google_trends": null,
     "kleinanzeigen": null,
     "narutop99": 0.17,
     "youtube_comments": null,
     "youtube_videos": null
    }
   }
  },
  "sources": [
   {
    "benchmark_value": 1459.0,
    "comparable": false,
    "detail": "Naruto precision 0.74",
    "id": "amazon",
    "metric": "asins",
    "reason": "precision_low"
   },
   {
    "benchmark_value": 7086.0,
    "comparable": false,
    "detail": "Naruto precision 0.66",
    "id": "ebay",
    "metric": "items",
    "reason": "precision_low"
   },
   {
    "benchmark_value": null,
    "comparable": false,
    "detail": "tagger counts Naruto only as 'Uzumaki' or 'Naruto Uzumaki'",
    "id": "kleinanzeigen",
    "metric": "offer_ads",
    "reason": "alias_restricted"
   },
   {
    "benchmark_value": 3880.0,
    "comparable": false,
    "detail": "Naruto precision 0.93, 95% CI from 0.69 (n = 14)",
    "id": "youtube_comments",
    "metric": "comments_de",
    "reason": "precision_uncertain"
   },
   {
    "benchmark_value": 2409.0,
    "comparable": false,
    "detail": "no Naruto precision measured",
    "id": "youtube_videos",
    "metric": "videos_de",
    "reason": "not_measured"
   },
   {
    "benchmark_value": 37.73,
    "comparable": false,
    "detail": "r = 0.94 between search term 'Naruto' and franchise topic; Naruto topic /m/02sp46 censored",
    "id": "google_trends",
    "metric": "interest_52w",
    "reason": "franchise_dominated"
   },
   {
    "benchmark_value": 3.0,
    "comparable": false,
    "detail": "Naruto matched only as 'Naruto Uzumaki'",
    "id": "anime2you_comments",
    "metric": "comment_mentions",
    "reason": "alias_restricted"
   },
   {
    "benchmark_value": 130.0,
    "comparable": false,
    "detail": "archive extraction; Naruto handling unknown",
    "id": "anime2you_articles",
    "metric": "articles",
    "reason": "not_measured"
   },
   {
    "benchmark_value": 34959.0,
    "comparable": true,
    "detail": "direct vote counts",
    "id": "narutop99",
    "metric": "votes_eu",
    "reason": "vote"
   }
  ]
 },
 "characters": [
  {
   "accuracy": {
    "amazon": 1.0,
    "anime2you": 1.0,
    "ebay": 0.9,
    "youtube": 1.0
   },
   "confidence": "robust",
   "counts": {
    "amazon_products": 129,
    "anime2you_articles": 52,
    "anime2you_comment_mentions": 157,
    "ebay_items": 623,
    "fan_votes_eu": 34797,
    "google_interest": 4.06,
    "kleinanzeigen_ads": null,
    "youtube_comments_de": 1405,
    "youtube_videos_de": 647
   },
   "flags": [],
   "index": 93,
   "key": "sasuke_uchiha",
   "lens_ranks": {
    "shoppers": 1.0,
    "votes": 5.0,
    "watching": 1.0
   },
   "name": "Sasuke Uchiha",
   "prices_eur": {
    "amazon": 23.99,
    "ebay": 27.0,
    "kleinanzeigen": null
   },
   "rank": 1,
   "role": "candidate",
   "top3_sources": 6
  },
  {
   "accuracy": {
    "amazon": 1.0,
    "anime2you": 1.0,
    "ebay": 1.0,
    "youtube": 1.0
   },
   "confidence": "robust",
   "counts": {
    "amazon_products": 95,
    "anime2you_articles": 17,
    "anime2you_comment_mentions": 49,
    "ebay_items": 562,
    "fan_votes_eu": 129376,
    "google_interest": 3.1,
    "kleinanzeigen_ads": null,
    "youtube_comments_de": 1104,
    "youtube_videos_de": 416
   },
   "flags": [],
   "index": 89,
   "key": "itachi_uchiha",
   "lens_ranks": {
    "shoppers": 2.33,
    "votes": 2.0,
    "watching": 2.67
   },
   "name": "Itachi Uchiha",
   "prices_eur": {
    "amazon": 20.99,
    "ebay": 25.95,
    "kleinanzeigen": null
   },
   "rank": 2,
   "role": "candidate",
   "top3_sources": 6
  },
  {
   "accuracy": {
    "amazon": 1.0,
    "anime2you": 1.0,
    "ebay": 1.0,
    "youtube": 1.0
   },
   "confidence": "robust",
   "counts": {
    "amazon_products": 89,
    "anime2you_articles": 25,
    "anime2you_comment_mentions": 60,
    "ebay_items": 475,
    "fan_votes_eu": 50773,
    "google_interest": 2.4,
    "kleinanzeigen_ads": null,
    "youtube_comments_de": 692,
    "youtube_videos_de": 357
   },
   "flags": [
    "low_precision"
   ],
   "index": 83,
   "key": "kakashi_hatake",
   "lens_ranks": {
    "shoppers": 2.67,
    "votes": 3.0,
    "watching": 3.67
   },
   "name": "Kakashi Hatake",
   "prices_eur": {
    "amazon": 24.99,
    "ebay": 30.08,
    "kleinanzeigen": null
   },
   "rank": 3,
   "role": "candidate",
   "top3_sources": 5
  },
  {
   "accuracy": {
    "amazon": 1.0,
    "anime2you": 1.0,
    "ebay": 1.0,
    "youtube": 1.0
   },
   "confidence": "mixed",
   "counts": {
    "amazon_products": 31,
    "anime2you_articles": 11,
    "anime2you_comment_mentions": 27,
    "ebay_items": 183,
    "fan_votes_eu": 50237,
    "google_interest": null,
    "kleinanzeigen_ads": null,
    "youtube_comments_de": 982,
    "youtube_videos_de": 264
   },
   "flags": [
    "low_precision"
   ],
   "index": 68,
   "key": "madara_uchiha",
   "lens_ranks": {
    "shoppers": 5.67,
    "votes": 4.0,
    "watching": 4.0
   },
   "name": "Madara Uchiha",
   "prices_eur": {
    "amazon": 35.62,
    "ebay": 38.0,
    "kleinanzeigen": null
   },
   "rank": 4,
   "role": "candidate",
   "top3_sources": 1
  },
  {
   "accuracy": {
    "amazon": 0.8,
    "anime2you": 0.991,
    "ebay": 0.9,
    "youtube": 0.975
   },
   "confidence": "mixed",
   "counts": {
    "amazon_products": 41,
    "anime2you_articles": 15,
    "anime2you_comment_mentions": 18,
    "ebay_items": 85,
    "fan_votes_eu": 223694,
    "google_interest": null,
    "kleinanzeigen_ads": null,
    "youtube_comments_de": 446,
    "youtube_videos_de": 131
   },
   "flags": [
    "low_precision"
   ],
   "index": 64,
   "key": "minato_namikaze",
   "lens_ranks": {